{
  "schemaVersion": 1,
  "knowledgeBaseVersion": "1.0.0",
  "title": "PanicLab Rule Pack v1",
  "generatedAt": "2026-08-21T12:57:00-03:00",
  "locale": "es-UY",
  "enginePolicy": {
    "deterministic": true,
    "exactRuleBeforeCombination": true,
    "explicitCombinationBeforeBitmask": true,
    "deviceSpecificBeforeProfile": true,
    "unknownMustNotGuess": true,
    "lowConfidenceMayBePrimary": false,
    "communityHintMayBePrimary": false,
    "storeAppliedRuleIdsInHistory": true,
    "storeKnowledgeBaseVersionInHistory": true
  },
  "confidenceDefinitions": {
    "HIGH": "Relación bien documentada y/o repetida; aun así requiere confirmación física.",
    "MEDIUM": "Evidencia útil pero con limitaciones, variación por modelo o fuentes incompletas.",
    "LOW": "Pista comunitaria o evidencia insuficiente; no usar como diagnóstico principal automático.",
    "UNKNOWN": "La base no permite asociar de forma responsable un componente."
  },
  "verificationDefinitions": {
    "VERIFIED": "Regla de seguridad/comportamiento del motor o hecho directamente verificable.",
    "WELL_DOCUMENTED": "Documentado en una fuente técnica principal y/o casos repetidos.",
    "COMMUNITY_SUPPORTED": "Respaldado por técnicos/casos comunitarios, aún no consolidado en tabla principal.",
    "CONFLICTING_SOURCE": "Fuentes o secciones de una misma fuente discrepan.",
    "EXPERIMENTAL": "Clasificación preliminar; no debe disparar reemplazo de pieza.",
    "UNKNOWN": "Sin respaldo suficiente."
  },
  "sources": [
    {
      "id": "ifixit_kernel_panics",
      "title": "iPhone Kernel Panics",
      "publisher": "iFixit",
      "url": "https://www.ifixit.com/Wiki/iPhone_Kernel_Panics",
      "checkedAt": "2026-08-21",
      "trustLevel": "HIGH",
      "supports": [
        "thermalmonitord missing sensor mappings",
        "watchdog no-check-in behavior",
        "I2C classification guidance",
        "AOP NMI POWER",
        "AOP Bosch control channel",
        "ANS2",
        "AppleSocHot",
        "SEP ROM Boot Panic",
        "SMC overview",
        "Undefined Kernel Instruction"
      ]
    },
    {
      "id": "ifixit_smc_assert",
      "title": "iPhone SMC Panic Assert",
      "publisher": "iFixit",
      "url": "https://www.ifixit.com/Wiki/iPhone_SMC_Panic_Assertion_Failed",
      "checkedAt": "2026-08-21",
      "trustLevel": "HIGH",
      "supports": [
        "SMC sensor-array mappings iPhone 13-16 Pro/Max",
        "multi-part hexadecimal behavior",
        "advanced connector/diode-mode troubleshooting"
      ]
    },
    {
      "id": "ifixit_16_series_charge_community",
      "title": "SMC PANIC - SMC BSC failure, which component is causing this?",
      "publisher": "iFixit Answers",
      "url": "https://www.ifixit.com/Answers/View/957760/SMC%2BPANIC%2B-%2BSMC%2BBSC%2Bfailure%2C%2Bwhich%2Bcomponent%2Bis%2Bcausing%2Bthis",
      "checkedAt": "2026-08-21",
      "trustLevel": "COMMUNITY",
      "supports": [
        "0x300000 / 3145728 charging-port evidence on iPhone 16 Pro Max",
        "community claim that 0x100000 can also indicate charging-port damage",
        "community claim that the same family applies to 16/17 series"
      ]
    },
    {
      "id": "ifixit_13_charge_case",
      "title": "iPhone 13 Pro SMC 0x800 charge-port case",
      "publisher": "iFixit Answers",
      "url": "https://www.ifixit.com/Answers/View/856422/Why%2Bis%2Bmy%2Bphone%2Bgetting%2Bvery%2Bhot%2Band%2Bturns%2Boff%2Bevery%2B3%2Bminutes",
      "checkedAt": "2026-08-21",
      "trustLevel": "COMMUNITY_HIGH",
      "supports": [
        "iPhone 13 sensor-array 0x800 -> charge port"
      ]
    },
    {
      "id": "ifixit_15_charge_case",
      "title": "iPhone 15 SMC 0x80000 charge-port case",
      "publisher": "iFixit Answers",
      "url": "https://www.ifixit.com/Answers/View/874876/iPhone%2B15%2C%2Brestarting%2Bevery%2B3%2Bmiutes%2C%2BI%2Battached%2Bthe%2Bcrash%2Blog",
      "checkedAt": "2026-08-21",
      "trustLevel": "COMMUNITY_HIGH",
      "supports": [
        "iPhone 15 sensor-array 0x80000 -> charge port"
      ]
    },
    {
      "id": "appledb_devices",
      "title": "Device Selection (iPhone)",
      "publisher": "AppleDB",
      "url": "https://appledb.dev/device-selection/iPhone.html",
      "checkedAt": "2026-08-21",
      "trustLevel": "HIGH_FOR_IDENTIFIERS",
      "supports": [
        "iPhone product identifier to marketing-name mapping from iPhone X through iPhone 17e"
      ]
    }
  ],
  "deviceModels": [
    {
      "productCode": "iPhone10,3",
      "marketingName": "iPhone X",
      "family": "IPHONE_X",
      "variant": "X",
      "diagnosticProfile": "THERMAL_CLASSIC_X_TO_12",
      "releaseYear": 2017,
      "sourceIds": ["appledb_devices"]
    },
    {
      "productCode": "iPhone10,6",
      "marketingName": "iPhone X",
      "family": "IPHONE_X",
      "variant": "X",
      "diagnosticProfile": "THERMAL_CLASSIC_X_TO_12",
      "releaseYear": 2017,
      "sourceIds": ["appledb_devices"]
    },
    {
      "productCode": "iPhone11,2",
      "marketingName": "iPhone XS",
      "family": "IPHONE_XS",
      "variant": "XS",
      "diagnosticProfile": "THERMAL_CLASSIC_X_TO_12",
      "releaseYear": 2018,
      "sourceIds": ["appledb_devices"]
    },
    {
      "productCode": "iPhone11,4",
      "marketingName": "iPhone XS Max",
      "family": "IPHONE_XS_MAX",
      "variant": "XS_MAX",
      "diagnosticProfile": "THERMAL_CLASSIC_X_TO_12",
      "releaseYear": 2018,
      "sourceIds": ["appledb_devices"]
    },
    {
      "productCode": "iPhone11,6",
      "marketingName": "iPhone XS Max",
      "family": "IPHONE_XS_MAX",
      "variant": "XS_MAX",
      "diagnosticProfile": "THERMAL_CLASSIC_X_TO_12",
      "releaseYear": 2018,
      "sourceIds": ["appledb_devices"]
    },
    {
      "productCode": "iPhone11,8",
      "marketingName": "iPhone XR",
      "family": "IPHONE_XR",
      "variant": "XR",
      "diagnosticProfile": "THERMAL_CLASSIC_X_TO_12",
      "releaseYear": 2018,
      "sourceIds": ["appledb_devices"]
    },
    {
      "productCode": "iPhone12,1",
      "marketingName": "iPhone 11",
      "family": "IPHONE_11",
      "variant": "11",
      "diagnosticProfile": "THERMAL_CLASSIC_X_TO_12",
      "releaseYear": 2019,
      "sourceIds": ["appledb_devices"]
    },
    {
      "productCode": "iPhone12,3",
      "marketingName": "iPhone 11 Pro",
      "family": "IPHONE_11_PRO",
      "variant": "11_PRO",
      "diagnosticProfile": "THERMAL_CLASSIC_X_TO_12",
      "releaseYear": 2019,
      "sourceIds": ["appledb_devices"]
    },
    {
      "productCode": "iPhone12,5",
      "marketingName": "iPhone 11 Pro Max",
      "family": "IPHONE_11_PRO_MAX",
      "variant": "11_PRO_MAX",
      "diagnosticProfile": "THERMAL_CLASSIC_X_TO_12",
      "releaseYear": 2019,
      "sourceIds": ["appledb_devices"]
    },
    {
      "productCode": "iPhone12,8",
      "marketingName": "iPhone SE (2nd generation)",
      "family": "IPHONE_SE2",
      "variant": "SE2",
      "diagnosticProfile": "THERMAL_CLASSIC_X_TO_12",
      "releaseYear": 2020,
      "sourceIds": ["appledb_devices"]
    },
    {
      "productCode": "iPhone13,1",
      "marketingName": "iPhone 12 mini",
      "family": "IPHONE_12_MINI",
      "variant": "12_MINI",
      "diagnosticProfile": "THERMAL_CLASSIC_X_TO_12",
      "releaseYear": 2020,
      "sourceIds": ["appledb_devices"]
    },
    {
      "productCode": "iPhone13,2",
      "marketingName": "iPhone 12",
      "family": "IPHONE_12",
      "variant": "12",
      "diagnosticProfile": "THERMAL_CLASSIC_X_TO_12",
      "releaseYear": 2020,
      "sourceIds": ["appledb_devices"]
    },
    {
      "productCode": "iPhone13,3",
      "marketingName": "iPhone 12 Pro",
      "family": "IPHONE_12_PRO",
      "variant": "12_PRO",
      "diagnosticProfile": "THERMAL_CLASSIC_X_TO_12",
      "releaseYear": 2020,
      "sourceIds": ["appledb_devices"]
    },
    {
      "productCode": "iPhone13,4",
      "marketingName": "iPhone 12 Pro Max",
      "family": "IPHONE_12_PRO_MAX",
      "variant": "12_PRO_MAX",
      "diagnosticProfile": "THERMAL_CLASSIC_X_TO_12",
      "releaseYear": 2020,
      "sourceIds": ["appledb_devices"]
    },
    {
      "productCode": "iPhone14,2",
      "marketingName": "iPhone 13 Pro",
      "family": "IPHONE_13_PRO",
      "variant": "13_PRO",
      "diagnosticProfile": "SMC_13",
      "releaseYear": 2021,
      "sourceIds": ["appledb_devices"]
    },
    {
      "productCode": "iPhone14,3",
      "marketingName": "iPhone 13 Pro Max",
      "family": "IPHONE_13_PRO_MAX",
      "variant": "13_PRO_MAX",
      "diagnosticProfile": "SMC_13",
      "releaseYear": 2021,
      "sourceIds": ["appledb_devices"]
    },
    {
      "productCode": "iPhone14,4",
      "marketingName": "iPhone 13 mini",
      "family": "IPHONE_13_MINI",
      "variant": "13_MINI",
      "diagnosticProfile": "SMC_13_MINI",
      "releaseYear": 2021,
      "sourceIds": ["appledb_devices"]
    },
    {
      "productCode": "iPhone14,5",
      "marketingName": "iPhone 13",
      "family": "IPHONE_13",
      "variant": "13",
      "diagnosticProfile": "SMC_13",
      "releaseYear": 2021,
      "sourceIds": ["appledb_devices"]
    },
    {
      "productCode": "iPhone14,6",
      "marketingName": "iPhone SE (3rd generation)",
      "family": "IPHONE_SE3",
      "variant": "SE3",
      "diagnosticProfile": "THERMAL_CLASSIC_X_TO_12",
      "releaseYear": 2022,
      "sourceIds": ["appledb_devices"]
    },
    {
      "productCode": "iPhone14,7",
      "marketingName": "iPhone 14",
      "family": "IPHONE_14",
      "variant": "14",
      "diagnosticProfile": "SMC_14_BASE",
      "releaseYear": 2022,
      "sourceIds": ["appledb_devices"]
    },
    {
      "productCode": "iPhone14,8",
      "marketingName": "iPhone 14 Plus",
      "family": "IPHONE_14_PLUS",
      "variant": "14_PLUS",
      "diagnosticProfile": "SMC_14_BASE",
      "releaseYear": 2022,
      "sourceIds": ["appledb_devices"]
    },
    {